{
  "$schema": "https://json-schema.org/draft/2020-12/schema",
  "title": "入境旅游服务标准互认共享资料",
  "type": "object",
  "required": [
    "domain",
    "version",
    "sample_id",
    "actors",
    "services",
    "recognition_levels",
    "change_triggers",
    "facts",
    "constraints"
  ],
  "properties": {
    "domain": {
      "type": "string",
      "minLength": 1
    },
    "version": {
      "type": "integer",
      "minimum": 1
    },
    "sample_id": {
      "type": "string",
      "minLength": 1
    },
    "actors": {
      "type": "array",
      "minItems": 2,
      "items": {
        "type": "string"
      }
    },
    "services": {
      "type": "array",
      "minItems": 2,
      "items": {
        "type": "string"
      }
    },
    "recognition_levels": {
      "type": "array",
      "minItems": 2,
      "items": {
        "type": "string"
      }
    },
    "change_triggers": {
      "type": "array",
      "minItems": 2,
      "items": {
        "type": "string"
      }
    },
    "facts": {
      "type": "array",
      "minItems": 2,
      "items": {
        "type": "string"
      }
    },
    "constraints": {
      "type": "array",
      "minItems": 2,
      "items": {
        "type": "string"
      }
    }
  },
  "additionalProperties": false
}
