{
  "domain": "tourism-standard-recognition",
  "version": 2,
  "sample_id": "record-012",
  "actors": [
    "东盟旅行社",
    "国内景区",
    "支付机构",
    "接待企业",
    "行业协会",
    "认证机构",
    "旅游主管部门"
  ],
  "services": [
    "多语种接待",
    "支付帮助",
    "应急联络"
  ],
  "recognition_levels": [
    "自我声明",
    "第三方认证",
    "正式互认"
  ],
  "change_triggers": [
    "标准修订",
    "认证暂停",
    "抽查不合格",
    "机构退出",
    "跨境关系撤销"
  ],
  "facts": [
    "便利化活动探索入境旅游服务标准化发展路径",
    "参会方来自主管部门、东盟行业协会、金融机构和文旅企业",
    "跨境支付与数字文旅属于核心议题",
    "服务标识标明多语种接待、支付帮助、应急联络的适用地区与有效时段，不混用各企业自我声明",
    "行业协会组织东盟旅行社、国内景区、支付机构和接待企业开展互认",
    "服务条款、语言版本、证据要求、认证机构与现场核验结果按适用地区关联",
    "供应商提交对应版本材料后才能获得有限范围的标识",
    "企业可查看差距并整改",
    "主管部门能够区分自我声明、第三方认证与正式互认",
    "标准修订、认证暂停、抽查不合格、机构退出或跨境关系撤销时，所有在售产品必须准确更新",
    "从原标识可追到核验记录和责任主体"
  ],
  "constraints": [
    "多地服务标准",
    "合规证据核验",
    "互认关系",
    "在售产品影响",
    "适用地区关联",
    "版本化材料",
    "有限范围标识",
    "分级互认依据",
    "在售产品同步更新",
    "标识可追溯"
  ]
}
